{
  "$schema": "../theme.schema.json",
  "id": "editorial",
  "name": "Editorial",
  "description": "Warm, typographic, and composed like a modern magazine.",
  "packageVersion": "1.1.0",
  "markupVersion": 1,
  "marpTheme": "editorial",
  "css": "theme.css",
  "fonts": {
    "display": ["Georgia", "Times New Roman", "serif"],
    "body": ["Arial", "Helvetica", "sans-serif"],
    "label": ["Arial", "Helvetica", "sans-serif"],
    "genericFallback": "serif"
  },
  "palette": {
    "background": "#eee8dc",
    "foreground": "#321f2e",
    "accent": "#c63f32",
    "secondary": "#d3bd65",
    "dark": "#321f2e",
    "light": "#fffaf0",
    "muted": "#5a4653"
  },
  "media": {
    "pictureTreatment": "Editorial documentary photography with warm paper tones, restrained saturation, natural light, deliberate framing, and uncluttered protected focal regions.",
    "diagramTreatment": "Restrained aubergine and coral linework on a light paper panel; precise labels and semantic encodings remain ungraded and uncropped."
  },
  "diagramRoles": {
    "base": {"fill": "light", "stroke": "foreground", "fontColor": "foreground", "strokeDash": 0, "fontSize": 28},
    "emphasis": {"fill": "foreground", "stroke": "foreground", "fontColor": "light", "strokeDash": 0, "fontSize": 28},
    "muted": {"fill": "background", "stroke": "muted", "fontColor": "muted", "strokeDash": 0, "fontSize": 28},
    "risk": {"fill": "accent", "stroke": "accent", "fontColor": "light", "strokeDash": 0, "fontSize": 28},
    "boundary": {"fill": "background", "stroke": "muted", "fontColor": "foreground", "strokeDash": 4, "fontSize": 28},
    "flow": {"stroke": "foreground", "fontColor": "foreground", "strokeDash": 0, "fontSize": 24},
    "optional-flow": {"stroke": "muted", "fontColor": "muted", "strokeDash": 5, "fontSize": 24},
    "risk-flow": {"stroke": "accent", "fontColor": "accent", "strokeDash": 0, "fontSize": 24}
  },
  "archetypes": {
    "title": {
      "class": "archetype-title",
      "tone": "tone-light",
      "slots": ["title", "subtitle", "media"],
      "capacity": {"titleLines": 3, "subtitleLines": 2},
      "variations": [{"id": "default", "class": "variation-default", "when": "always"}]
    },
    "section": {
      "class": "archetype-section",
      "tone": "tone-light",
      "slots": ["title", "orientation"],
      "capacity": {"titleLines": 3, "orientationLines": 2},
      "variations": [{"id": "default", "class": "variation-default", "when": "always"}]
    },
    "text-only": {
      "class": "archetype-text-only",
      "tone": "tone-light",
      "slots": ["heading", "body"],
      "capacity": {"headingLines": 2, "bullets": 5, "bulletLines": 2},
      "variations": [{"id": "default", "class": "variation-default", "when": "always"}]
    },
    "text-plus-image": {
      "class": "archetype-text-plus-image",
      "tone": "tone-light",
      "slots": ["heading", "body", "media", "caption"],
      "capacity": {"headingLines": 2, "bullets": 4, "bulletLines": 2, "captionLines": 2},
      "variations": [
        {"id": "portrait", "class": "variation-portrait", "when": "orientation=portrait"},
        {"id": "landscape", "class": "variation-landscape", "when": "orientation=landscape"},
        {"id": "full-image", "class": "variation-full-image", "when": "orientation=full-image"}
      ]
    },
    "data": {
      "class": "archetype-data",
      "tone": "tone-light",
      "slots": ["heading", "metrics", "media", "takeaway"],
      "capacity": {"headingLines": 2, "charts": 1, "metrics": 4, "takeawayLines": 2},
      "variations": [{"id": "default", "class": "variation-default", "when": "always"}]
    },
    "diagram": {
      "class": "archetype-diagram",
      "tone": "tone-light",
      "slots": ["heading", "media", "caption"],
      "capacity": {"headingLines": 2, "diagrams": 1, "captionLines": 2},
      "variations": [{"id": "default", "class": "variation-default", "when": "always"}]
    },
    "quotation": {
      "class": "archetype-quotation",
      "tone": "tone-dark",
      "slots": ["quote", "attribution", "context"],
      "capacity": {"quoteLines": 4, "attributionLines": 2, "contextLines": 1},
      "variations": [{"id": "default", "class": "variation-default", "when": "always"}]
    }
  },
  "assets": []
}
